{
  "post_type": "image_text",

  "title": "上海阿姨找对了，家里干净得像换了套房",

  "content": "搬到上海三年，换了5个保洁阿姨，踩了无数坑😭\n\n终于找到一个靠谱的，分享一下我的筛选方法👇\n\n✨ 第一步：看服务细节\n别只看价格！重点问阿姨会不会擦踢脚线、会不会整理冰箱内部。细节决定一切。\n\n✨ 第二步：先试做一次\n千万别一上来就包月。先约一次体验，观察她的工具是不是自带、干活顺序对不对。\n\n✨ 第三步：看时间观念\n迟到超过15分钟的直接pass。时间观念差的阿姨，活儿一般也糙。\n\n现在每周来一次，每次3小时，家里一直保持拎包入住的状态✨\n\n有同样经历的姐妹可以评论区聊聊～需要推荐的也可以问我",

  "tags": ["#上海家政", "#保洁推荐", "#阿姨推荐", "#同城服务", "#家居清洁", "#生活小妙招", "#上海生活"],

  "files": [
    "/Users/burning/Desktop/content/xhs/clean-home-01.jpg",
    "/Users/burning/Desktop/content/xhs/clean-home-02.jpg",
    "/Users/burning/Desktop/content/xhs/clean-home-03.jpg"
  ],

  "cover_index": 0,
  "location": "上海·浦东新区",
  "mentions": ["@家政小王", "@上海生活指南"],

  "group_chat": "家政交流群",
  "schedule": "2026-03-20 09:00",
  "product": "多功能清洁刷套装",
  "file": "/Users/burning/Desktop/content/xhs/cleaning-checklist.pdf",

  "meta": {
    "id": "xhs-20260319-210000-test-full",
    "created_at": "2026-03-19T21:00:00",
    "source_topic": "家政服务避坑指南",
    "variant": "全字段测试",
    "obsidian_note": "素材库/6-内容产出/小红书/20260319-家政避坑-test-full.md",
    "status": "pending",
    "published_at": null,
    "error": null
  }
}
